Company,Weight,Percentage,Sharpe Ratio,Annual Return
"AirNet Technology Inc. - American Depositary Shares, each representing ten ordinary shares",0.0,0.0,1.4126544532040528,38992.98030695108
"Cisco Systems, Inc. - Common Stock",0.0,0.0,1.4126544532040528,38992.98030695108
"Primerica, Inc. Common Stock",0.0,0.0,1.4126544532040528,38992.98030695108
Nuveen Municipal Credit Income Fund ,0.0008627429051586982,0.08627429051586982,1.4126544532040528,38992.98030695108
Unit Corporation Common Stock,0.0,0.0,1.4126544532040528,38992.98030695108
"HubSpot, Inc. Common Stock",0.09953528058682877,9.953528058682878,1.4126544532040528,38992.98030695108
Great Panther Mining Limited Ordinary Shares (Canada),0.0,0.0,1.4126544532040528,38992.98030695108
"Sinclair Broadcast Group, Inc. - Class A Common Stock",0.0,0.0,1.4126544532040528,38992.98030695108
"United Fire Group, Inc - Common Stock",0.0006319828617887037,0.06319828617887037,1.4126544532040528,38992.98030695108
AB Svensk Ekportkredit (Swedish Export Credit Corporation) ELEMENTS Linked to the Rogers International Commodity Index - Metals Total Return Structured Product,0.0,0.0,1.4126544532040528,38992.98030695108
"Guaranty Federal Bancshares, Inc. - Common Stock",4.8479449815548444e-05,0.004847944981554844,1.4126544532040528,38992.98030695108
"Air T, Inc. - Common Stock",4.522705368044683e-06,0.00045227053680446823,1.4126544532040528,38992.98030695108
SITE Centers Corp. Common Stock,0.0,0.0,1.4126544532040528,38992.98030695108
Nuveen New York Select Tax-Free Income Portfolio Common Stock,0.0,0.0,1.4126544532040528,38992.98030695108
BlackRock New York Municipal Income Trust,0.0,0.0,1.4126544532040528,38992.98030695108
"Regional Health Properties, Inc. Common Stock",0.0,0.0,1.4126544532040528,38992.98030695108
"Innovative Solutions and Support, Inc. - Common Stock",0.0,0.0,1.4126544532040528,38992.98030695108
"Kandi Technologies Group, Inc. - Common Stock",0.0,0.0,1.4126544532040528,38992.98030695108
Eaton Vance Floating Rate Income Trust Common Shares of Beneficial Interest,0.0,0.0,1.4126544532040528,38992.98030695108
"Transcat, Inc. - Common Stock",0.0,0.0,1.4126544532040528,38992.98030695108
Carolina Financial Corporation - Common Stock,0.0,0.0,1.4126544532040528,38992.98030695108
"Natuzzi, S.p.A.",2.7830906661961604e-07,2.7830906661961603e-05,1.4126544532040528,38992.98030695108
"Advanced Energy Industries, Inc. - Common Stock",7.475542371989632e-07,7.475542371989633e-05,1.4126544532040528,38992.98030695108
"United Airlines Holdings, Inc. - Common Stock",0.0,0.0,1.4126544532040528,38992.98030695108
"T. Rowe Price Group, Inc. - Common Stock",0.0,0.0,1.4126544532040528,38992.98030695108
"Intuitive Surgical, Inc. - Common Stock",0.09953528058682877,9.953528058682878,1.4126544532040528,38992.98030695108
"EastGroup Properties, Inc. Common Stock",0.09953528058682877,9.953528058682878,1.4126544532040528,38992.98030695108
Ellington Financial Inc. Common Stock ,0.00094354711639119,0.094354711639119,1.4126544532040528,38992.98030695108
"NVR, Inc. Common Stock",0.0,0.0,1.4126544532040528,38992.98030695108
"Frequency Electronics, Inc. - Common Stock",0.0,0.0,1.4126544532040528,38992.98030695108
"Worthington Industries, Inc. Common Stock",0.0,0.0,1.4126544532040528,38992.98030695108
Perrigo Company plc Ordinary Shares,0.0,0.0,1.4126544532040528,38992.98030695108
"Lincoln Electric Holdings, Inc. - Common Shares",9.128240508656849e-06,0.0009128240508656848,1.4126544532040528,38992.98030695108
RPT Realty Common Stock,0.0,0.0,1.4126544532040528,38992.98030695108
"Veracyte, Inc. - Common Stock",0.0,0.0,1.4126544532040528,38992.98030695108
"USA Compression Partners, LP Common Units Representing Limited Partner Interests",0.0,0.0,1.4126544532040528,38992.98030695108
Cohen & Company Inc.,2.2162166023739474e-05,0.002216216602373947,1.4126544532040528,38992.98030695108
Neuberger Berman California Municipal Fund Inc Common Stock,0.0,0.0,1.4126544532040528,38992.98030695108
"Douglas Dynamics, Inc. Common Stock",0.0,0.0,1.4126544532040528,38992.98030695108
Pivotal Investment Corporation II Class A Common Stock,0.09953528058682877,9.953528058682878,1.4126544532040528,38992.98030695108
"PRGX Global, Inc. - Common Stock",0.0,0.0,1.4126544532040528,38992.98030695108
Enerplus Corporation Common Stock,9.164056658394826e-06,0.0009164056658394826,1.4126544532040528,38992.98030695108
"India Fund, Inc. (The) Common Stock",4.084548755386295e-05,0.004084548755386295,1.4126544532040528,38992.98030695108
Koninklijke Philips N.V. NY Registry Shares,0.0,0.0,1.4126544532040528,38992.98030695108
UNIVERSAL INSURANCE HOLDINGS INC Common Stock,0.0,0.0,1.4126544532040528,38992.98030695108
Anheuser-Busch Inbev SA Sponsored ADR (Belgium),0.0,0.0,1.4126544532040528,38992.98030695108
Orrstown Financial Services Inc - Common Stock,0.0,0.0,1.4126544532040528,38992.98030695108
PIMCO Income Strategy Fund Shares of Beneficial Interest,0.0,0.0,1.4126544532040528,38992.98030695108
Precision Drilling Corporation Common Stock,0.0,0.0,1.4126544532040528,38992.98030695108
"Orion Energy Systems, Inc. - Common Stock",0.0,0.0,1.4126544532040528,38992.98030695108
"Ballard Power Systems, Inc. - Common Shares",0.0,0.0,1.4126544532040528,38992.98030695108
"Northern Oil and Gas, Inc. Common Stock",7.44197182454405e-05,0.007441971824544051,1.4126544532040528,38992.98030695108
Bluelinx Holdings Inc. Common Stock,0.0,0.0,1.4126544532040528,38992.98030695108
DWS Strategic Municipal Income Trust,0.0,0.0,1.4126544532040528,38992.98030695108
City Holding Company - Common Stock,0.0,0.0,1.4126544532040528,38992.98030695108
Liberty Global plc - Class C Ordinary Shares,0.0,0.0,1.4126544532040528,38992.98030695108
"Spok Holdings, Inc. - Common Stock",0.0,0.0,1.4126544532040528,38992.98030695108
Steel Partners Holdings LP LTD PARTNERSHIP UNIT,0.0,0.0,1.4126544532040528,38992.98030695108
"Tapestry, Inc. Common Stock",6.267361123361581e-09,6.26736112336158e-07,1.4126544532040528,38992.98030695108
"TCW Strategic Income Fund, Inc. Common Stock",7.626439512232645e-06,0.0007626439512232645,1.4126544532040528,38992.98030695108
Devon Energy Corporation Common Stock,0.0,0.0,1.4126544532040528,38992.98030695108
MGE Energy Inc. - Common Stock,0.0,0.0,1.4126544532040528,38992.98030695108
American Superconductor Corporation - Common Stock,0.0,0.0,1.4126544532040528,38992.98030695108
"Servotronics, Inc. Common Stock",0.0,0.0,1.4126544532040528,38992.98030695108
Columbia Seligman Premium Technology Growth Fund Inc,0.0,0.0,1.4126544532040528,38992.98030695108
Acceleron Pharma Inc. - Common Stock,0.00020218370756900763,0.020218370756900764,1.4126544532040528,38992.98030695108
"Stanley Black & Decker, Inc. Corporate Units",0.0,0.0,1.4126544532040528,38992.98030695108
"DTE Energy Company 2012 Series C 5.25% Junior Subordinate Debentures due December 1, 2062",0.0,0.0,1.4126544532040528,38992.98030695108
"SCYNEXIS, Inc. - Common Stock",0.0,0.0,1.4126544532040528,38992.98030695108
"Manning & Napier, Inc. Class A Common Stock",0.0,0.0,1.4126544532040528,38992.98030695108
"Amtech Systems, Inc. - Common Stock",0.0,0.0,1.4126544532040528,38992.98030695108
"Inspired Entertainment, Inc. - Common Stock",0.0001337493935260112,0.01337493935260112,1.4126544532040528,38992.98030695108
Service Properties Trust - Shares of Beneficial Interest,0.0,0.0,1.4126544532040528,38992.98030695108
"DTF Tax-Free Income, Inc. Common Stock",0.0,0.0,1.4126544532040528,38992.98030695108
Hanmi Financial Corporation - Common Stock,0.0,0.0,1.4126544532040528,38992.98030695108
Crane Co. Common Stock,0.010089606887243857,1.0089606887243858,1.4126544532040528,38992.98030695108
"ADTRAN, Inc. - Common Stock",0.0,0.0,1.4126544532040528,38992.98030695108
"Coffee Holding Co., Inc. - Common Stock",0.0,0.0,1.4126544532040528,38992.98030695108
Sandstorm Gold Ltd. Ordinary Shares (Canada),0.0,0.0,1.4126544532040528,38992.98030695108
Daxor Corporation Common Stock,0.0,0.0,1.4126544532040528,38992.98030695108
Crestwood Equity Partners LP,0.0,0.0,1.4126544532040528,38992.98030695108
"Omega Flex, Inc. - Common Stock",0.0,0.0,1.4126544532040528,38992.98030695108
DURECT Corporation - Common Stock,0.0,0.0,1.4126544532040528,38992.98030695108
Antero Midstream Corporation Common Stock,0.004360710924370475,0.43607109243704756,1.4126544532040528,38992.98030695108
Wayfair Inc. Class A Common Stock,0.0,0.0,1.4126544532040528,38992.98030695108
Adams Diversified Equity Fund Inc.,0.0,0.0,1.4126544532040528,38992.98030695108
"Blackrock MuniYield Quality Fund II, Inc. Common Stock",0.0,0.0,1.4126544532040528,38992.98030695108
Celanese Corporation Celanese Corporation Common Stock,0.0,0.0,1.4126544532040528,38992.98030695108
Astrotech Corporation - Common Stock,0.0,0.0,1.4126544532040528,38992.98030695108
Marathon Oil Corporation Common Stock,7.151843114050047e-09,7.151843114050047e-07,1.4126544532040528,38992.98030695108
"DB Gold Double Short ETN due February 15, 2038",0.0,0.0,1.4126544532040528,38992.98030695108
"Hovnanian Enterprises, Inc. Class A Common Stock",0.0,0.0,1.4126544532040528,38992.98030695108
"Neurocrine Biosciences, Inc. - Common Stock",0.0,0.0,1.4126544532040528,38992.98030695108
"Evertec, Inc. Common Stock",0.0,0.0,1.4126544532040528,38992.98030695108
Oaktree Strategic Income Corporation - Common Stock,0.0,0.0,1.4126544532040528,38992.98030695108
"Huami Corporation American Depositary Shares, each representing four Class A Ordinary Shares",0.0,0.0,1.4126544532040528,38992.98030695108
Boeing Company (The) Common Stock,0.09953528058682877,9.953528058682878,1.4126544532040528,38992.98030695108
Vertex Pharmaceuticals Incorporated - Common Stock,0.03637555201105093,3.637555201105093,1.4126544532040528,38992.98030695108
"American Financial Group, Inc. Common Stock",0.0,0.0,1.4126544532040528,38992.98030695108
"Grupo Financiero Galicia S.A. - American Depositary Shares, Class B Shares underlying",0.0,0.0,1.4126544532040528,38992.98030695108
New Senior Investment Group Inc. Common Stock,0.0,0.0,1.4126544532040528,38992.98030695108
"Gilead Sciences, Inc. - Common Stock",0.0,0.0,1.4126544532040528,38992.98030695108
"SharpSpring, Inc. - Common Stock",0.0,0.0,1.4126544532040528,38992.98030695108
"WW International, Inc.  - Common Stock",0.0,0.0,1.4126544532040528,38992.98030695108
"China Fund, Inc. (The) Common Stock",0.0,0.0,1.4126544532040528,38992.98030695108
iPath S&P VEQTOR ETN,0.0,0.0,1.4126544532040528,38992.98030695108
Algonquin Power & Utilities Corp. Common Shares,3.6987060060983385e-05,0.0036987060060983384,1.4126544532040528,38992.98030695108
Magnolia Oil & Gas Corporation Class A Common Stock,0.0,0.0,1.4126544532040528,38992.98030695108
Fortis Inc. Common Shares,0.0,0.0,1.4126544532040528,38992.98030695108
"Evans Bancorp, Inc. Common Stock",0.0,0.0,1.4126544532040528,38992.98030695108
SLM Corporation - Common Stock,0.0,0.0,1.4126544532040528,38992.98030695108
"New York Mortgage Trust, Inc. - 7.75% Series B Cumulative Redeemable Preferred Stock",0.0,0.0,1.4126544532040528,38992.98030695108
Sony Corporation Common Stock,0.0,0.0,1.4126544532040528,38992.98030695108
Nielsen N.V. Ordinary Shares,0.09108473661460774,9.108473661460774,1.4126544532040528,38992.98030695108
"Amkor Technology, Inc. - Common Stock",0.0,0.0,1.4126544532040528,38992.98030695108
"Vishay Precision Group, Inc. Common Stock",0.0,0.0,1.4126544532040528,38992.98030695108
Tenet Healthcare Corporation Common Stock,0.0,0.0,1.4126544532040528,38992.98030695108
"FirstCash, Inc. - Common Stock",0.0,0.0,1.4126544532040528,38992.98030695108
Calamos Convertible and High Income Fund - Common Stock,0.0,0.0,1.4126544532040528,38992.98030695108
"Taylor Devices, Inc. - Common Stock",0.0,0.0,1.4126544532040528,38992.98030695108
"MDU Resources Group, Inc. Common Stock (Holding Company)",0.0,0.0,1.4126544532040528,38992.98030695108
"Creative Realities, Inc. - Common Stock",0.0,0.0,1.4126544532040528,38992.98030695108
"Exela Technologies, Inc. - Common Stock",0.0,0.0,1.4126544532040528,38992.98030695108
Tidewater Inc. Common Stock,0.0,0.0,1.4126544532040528,38992.98030695108
TAT Technologies Ltd. - Ordinary Shares,0.0,0.0,1.4126544532040528,38992.98030695108
"Wayside Technology Group, Inc. - Common Stock",0.0,0.0,1.4126544532040528,38992.98030695108
"Cohen & Steers MLP Income and Energy Opportunity Fund, Inc. Common Stock",0.0,0.0,1.4126544532040528,38992.98030695108
"Camber Energy, Inc. Common Stock",0.0,0.0,1.4126544532040528,38992.98030695108
"Cullen/Frost Bankers, Inc. Common Stock",0.0,0.0,1.4126544532040528,38992.98030695108
"Sculptor Capital Management, Inc. Class A Common Stock",0.0,0.0,1.4126544532040528,38992.98030695108
Performant Financial Corporation - Common Stock,0.0,0.0,1.4126544532040528,38992.98030695108
Ducommun Incorporated Common Stock,0.0,0.0,1.4126544532040528,38992.98030695108
"China Green Agriculture, Inc. Common Stock",0.0,0.0,1.4126544532040528,38992.98030695108
"Tivity Health, Inc. - Common Stock",0.00023305421606381954,0.023305421606381955,1.4126544532040528,38992.98030695108
"Equinix, Inc. - Common Stock",0.0,0.0,1.4126544532040528,38992.98030695108
"Zillow Group, Inc. - Class A Common Stock",0.09953528058682877,9.953528058682878,1.4126544532040528,38992.98030695108
"Haverty Furniture Companies, Inc. Common Stock",0.0,0.0,1.4126544532040528,38992.98030695108
Stamps.com Inc. - Common Stock,0.0,0.0,1.4126544532040528,38992.98030695108
Pfenex Inc. Common Stock,0.0,0.0,1.4126544532040528,38992.98030695108
"Duos Technologies Group, Inc. - Common Stock",0.0,0.0,1.4126544532040528,38992.98030695108
Markel Corporation Common Stock,0.0,0.0,1.4126544532040528,38992.98030695108
"Gulf Resources, Inc. - Common Stock",0.0,0.0,1.4126544532040528,38992.98030695108
QuickLogic Corporation - Common Stock,2.172482128869008e-07,2.172482128869008e-05,1.4126544532040528,38992.98030695108
Huntsman Corporation Common Stock,0.0,0.0,1.4126544532040528,38992.98030695108
StoneMor Inc. Common Stock,0.0,0.0,1.4126544532040528,38992.98030695108
"Telephone and Data Systems, Inc. 5.875% Senior Notes due 2061",0.0,0.0,1.4126544532040528,38992.98030695108
Microbot Medical Inc.  - Common Stock,0.0,0.0,1.4126544532040528,38992.98030695108
"Teradyne, Inc. - Common Stock",0.0,0.0,1.4126544532040528,38992.98030695108
"Culp, Inc. Common Stock",0.05312013683694358,5.312013683694358,1.4126544532040528,38992.98030695108
Melco Resorts & Entertainment Limited - American Depositary Shares ,5.98748552387329e-07,5.9874855238732904e-05,1.4126544532040528,38992.98030695108
"SmartFinancial, Inc. - Common Stock",0.0,0.0,1.4126544532040528,38992.98030695108
GEE Group Inc. Common Stock,0.0,0.0,1.4126544532040528,38992.98030695108
"Vermillion, Inc. - Common Stock",0.0,0.0,1.4126544532040528,38992.98030695108
Insulet Corporation - Common Stock,0.0,0.0,1.4126544532040528,38992.98030695108
Tiffany & Co. Common Stock,0.0,0.0,1.4126544532040528,38992.98030695108
Medtronic plc. Ordinary Shares,0.0,0.0,1.4126544532040528,38992.98030695108
"ARC Document Solutions, Inc. Common Stock",0.0,0.0,1.4126544532040528,38992.98030695108
Adtalem Global Education Inc. Common Stock,0.0,0.0,1.4126544532040528,38992.98030695108
"Inter Parfums, Inc. - Common Stock",0.0,0.0,1.4126544532040528,38992.98030695108
"Select Asset Inc. Corporate Backed Callable Trust Certificates, J.C. Penney Debenture-Backed Series 2006-1, Class A-1",0.0006285879943013431,0.06285879943013431,1.4126544532040528,38992.98030695108
"Delta Apparel, Inc. Common Stock",0.0,0.0,1.4126544532040528,38992.98030695108
iStar Inc. Common Stock,0.0,0.0,1.4126544532040528,38992.98030695108
"HSBC Holdings, plc. Common Stock",6.274993842019614e-05,0.006274993842019614,1.4126544532040528,38992.98030695108
"Liberty All-Star Growth Fund, Inc.",0.0,0.0,1.4126544532040528,38992.98030695108
"Credit Suisse Asset Management Income Fund, Inc. Common Stock",0.0,0.0,1.4126544532040528,38992.98030695108
"Boot Barn Holdings, Inc. Common Stock",0.0,0.0,1.4126544532040528,38992.98030695108
"M.D.C. Holdings, Inc. Common Stock",0.0009621956899760781,0.09621956899760781,1.4126544532040528,38992.98030695108
Ubiquiti Inc. Common Stock,0.0,0.0,1.4126544532040528,38992.98030695108
"American Software, Inc. - Class A Common Stock",0.0,0.0,1.4126544532040528,38992.98030695108
"Plains Group Holdings, L.P. Class A Shares representing limited partner interests",0.0,0.0,1.4126544532040528,38992.98030695108
"FormFactor, Inc. - Common Stock",0.0,0.0,1.4126544532040528,38992.98030695108
Frontier Communications Corporation - Common Stock,0.0,0.0,1.4126544532040528,38992.98030695108
Dividend and Income Fund Common Stock,0.0,0.0,1.4126544532040528,38992.98030695108
Toyota Motor Corporation Common Stock,0.0,0.0,1.4126544532040528,38992.98030695108
Cumberland Pharmaceuticals Inc. - Common Stock,0.0,0.0,1.4126544532040528,38992.98030695108
Visa Inc.,1.2454372529403197e-05,0.0012454372529403198,1.4126544532040528,38992.98030695108
Ciena Corporation Common Stock,0.09953528058682877,9.953528058682878,1.4126544532040528,38992.98030695108
"Salem Media Group, Inc. - Class A Common Stock",0.0,0.0,1.4126544532040528,38992.98030695108
Standex International Corporation Common Stock,0.0,0.0,1.4126544532040528,38992.98030695108
Geospace Technologies Corporation - Common Stock,0.0,0.0,1.4126544532040528,38992.98030695108
iRadimed Corporation - Common Stock,0.0,0.0,1.4126544532040528,38992.98030695108
Air Lease Corporation Class A Common Stock,0.0,0.0,1.4126544532040528,38992.98030695108
"Babcock & Wilcox Enterprises, Inc. Common Stock",0.0,0.0,1.4126544532040528,38992.98030695108
"Agilent Technologies, Inc. Common Stock",0.0,0.0,1.4126544532040528,38992.98030695108
Credit Suisse Group American Depositary Shares,3.823393778055227e-05,0.0038233937780552275,1.4126544532040528,38992.98030695108
"Antares Pharma, Inc. - Common Stock",0.0,0.0,1.4126544532040528,38992.98030695108
Flaherty & Crumrine Total Return Fund Inc Common Stock,0.0,0.0,1.4126544532040528,38992.98030695108
"Huttig Building Products, Inc. - Common Stock",0.0,0.0,1.4126544532040528,38992.98030695108
"MagnaChip Semiconductor Corporation Depositary Shares, each representing one share of common stock",0.0,0.0,1.4126544532040528,38992.98030695108
"NACCO Industries, Inc. Common Stock",0.0,0.0,1.4126544532040528,38992.98030695108
"Duff & Phelps Utility & Corporate Bond Trust, Inc. Common Stock",0.0018062864855909707,0.18062864855909708,1.4126544532040528,38992.98030695108
DTE Energy Company 6.25% Corporate Units,6.783157884870247e-08,6.783157884870247e-06,1.4126544532040528,38992.98030695108
"FleetCor Technologies, Inc. Common Stock",0.09953528058682877,9.953528058682878,1.4126544532040528,38992.98030695108
HMS Holdings Corp - Common Stock,0.0019139849774582759,0.1913984977458276,1.4126544532040528,38992.98030695108
"Altria Group, Inc.",0.0,0.0,1.4126544532040528,38992.98030695108
Amplify Energy Corp. Common Stock,0.0,0.0,1.4126544532040528,38992.98030695108
"Home Federal Bancorp, Inc. of Louisiana - Common Stock",0.0,0.0,1.4126544532040528,38992.98030695108
Sunoco LP Common Units representing limited partner interests,0.0,0.0,1.4126544532040528,38992.98030695108
"AVEO Pharmaceuticals, Inc. - Common Stock",0.0,0.0,1.4126544532040528,38992.98030695108
